<?xml version="1.0" encoding="UTF-8"?>
<!-- Define a estrutura do arquivo XML que armazena os livros -->
<xs:schema xmlns:xs="http://www.w3.org/2001/XMLSchema">
  <xs:element name="livros">
    <xs:complexType>
      <xs:sequence>
        <xs:element name="livro" maxOccurs="unbounded" minOccurs="0">
          <xs:complexType>
            <xs:sequence>
              <xs:element name="nome" type="xs:string"/>
              <xs:element name="autor" type="xs:string"/>
              <xs:element name="preco" type="xs:decimal"/>
            </xs:sequence>
          </xs:complexType>
        </xs:element>
      </xs:sequence>
    </xs:complexType>
  </xs:element>
</xs:schema>
