<?xml version='1.0' encoding='utf-8'?>
<livros xmlns:xsi="http://www.w3.org/2001/XMLSchema-instance" xsi:noNamespaceSchemaLocation="Servidor/Soap/livros_schema.xsd"><livro><nome>Teste</nome><autor>Teste</autor><preco>1.0</preco></livro><livro><nome>Teste</nome><autor>Teste</autor><preco>1.0</preco></livro><livro><nome>a</nome><autor>Teste</autor><preco>1.0</preco></livro></livros>